[
  {
    "cpt": "99283",
    "description": "Emergency dept visit, moderate severity (records-supported level for the demo's upcoded 99285)",
    "medicare_rate": 245.0,
    "fh_estimate": 622.3,
    "mrf_cash": 1409.25,
    "mrf_negotiated_median": 328.79,
    "band_low": 367.5,
    "band_high": 612.5,
    "source_url": "PFS: 2.11 RVU x $33.4009 CF (2026 non-QP). OPPS: APC 5022 (ER L3) ~$176 (CF $91.42 x RW ~1.92). NC GPCI adj minimal (~0.99). CMS-1832-F + CMS-1834-FC."
  },
  {
    "cpt": "71046",
    "description": "Chest X-ray, 2 views (duplicated on the demo bill: $412 billed twice)",
    "medicare_rate": 63.0,
    "fh_estimate": 160.02,
    "mrf_cash": 354.0,
    "mrf_negotiated_median": 180.78,
    "band_low": 94.5,
    "band_high": 157.5,
    "source_url": "PFS global: 0.99 RVU x $33.4009. In hospital setting split: PC ~$8 (0.24 wRVU) + TC under OPPS APC 5521 ~$55. Combined ~$63. CMS-1832-F."
  },
  {
    "cpt": "80053",
    "description": "Comprehensive metabolic panel (unbundled into components on the demo bill: $690 vs $48)",
    "medicare_rate": 14.5,
    "fh_estimate": 36.83,
    "mrf_cash": 133.5,
    "mrf_negotiated_median": 94.87,
    "band_low": 21.75,
    "band_high": 36.25,
    "source_url": "CLFS: $10.33 national (no geographic variation). Hospital outpatient: CLFS rate + specimen collection/handling ~$4. 26CLABQ1."
  },
  {
    "cpt": "85025",
    "description": "Complete blood count w/ differential",
    "medicare_rate": 10.8,
    "fh_estimate": 27.43,
    "mrf_cash": 93.75,
    "mrf_negotiated_median": 66.63,
    "band_low": 16.2,
    "band_high": 27.0,
    "source_url": "CLFS: $7.77 national (April 2025-March 2026 period). Hospital outpatient: add collection/handling ~$3. 26CLABQ1."
  },
  {
    "cpt": "96374",
    "description": "IV push, single drug",
    "medicare_rate": 104.7,
    "fh_estimate": 265.94,
    "mrf_cash": 642.75,
    "mrf_negotiated_median": 328.23,
    "band_low": 157.05,
    "band_high": 261.75,
    "source_url": "PFS: 1.13 RVU x $33.4009. OPPS: drug admin APC ~$67 (CF $91.42 x RW ~0.73). CMS-1832-F + CMS-1834-FC."
  }
]