[
  {
    "cpt": "99283",
    "description": "Emergency dept visit, moderate severity (records-supported level for the demo's upcoded 99285)",
    "medicare_rate": 245.0,
    "fh_estimate": 622.0,
    "mrf_cash": 1050.0,
    "mrf_negotiated_median": 1450.0,
    "band_low": 367.5,
    "band_high": 612.5,
    "source_url": "PLACEHOLDER — replace via data/pipeline (CMS PFS/OPPS + hospital MRF)"
  },
  {
    "cpt": "71046",
    "description": "Chest X-ray, 2 views (duplicated on the demo bill: $412 billed twice)",
    "medicare_rate": 63.0,
    "fh_estimate": 160.0,
    "mrf_cash": 260.0,
    "mrf_negotiated_median": 360.0,
    "band_low": 94.5,
    "band_high": 157.5,
    "source_url": "PLACEHOLDER"
  },
  {
    "cpt": "80053",
    "description": "Comprehensive metabolic panel (unbundled into components on the demo bill: $690 vs $48)",
    "medicare_rate": 14.5,
    "fh_estimate": 37.0,
    "mrf_cash": 95.0,
    "mrf_negotiated_median": 130.0,
    "band_low": 21.75,
    "band_high": 36.25,
    "source_url": "PLACEHOLDER"
  },
  {
    "cpt": "85025",
    "description": "Complete blood count w/ differential",
    "medicare_rate": 10.8,
    "fh_estimate": 27.0,
    "mrf_cash": 60.0,
    "mrf_negotiated_median": 85.0,
    "band_low": 16.2,
    "band_high": 27.0,
    "source_url": "PLACEHOLDER"
  },
  {
    "cpt": "96374",
    "description": "IV push, single drug",
    "medicare_rate": 104.7,
    "fh_estimate": 266.0,
    "mrf_cash": 425.0,
    "mrf_negotiated_median": 575.0,
    "band_low": 157.05,
    "band_high": 261.75,
    "source_url": "PLACEHOLDER"
  }
]
